id,shelter_name,link_title,link_url,Address,City,State,Zip,phone,hours,hours2,notes,email
117,Animal Rescue Foundation of Louisiana,Animal Rescue Foundation of Louisiana,www.arfla.org,P.O. Box 53501,Lafayette,LA,70505,(337) 332-4756,"Mon - Fri, 9am-5pm",Contact to schedule an appointment.,,arfla.info@gmail.com
118,WAGS,WAGS,http://wagspetadoption.org/,6621 Westminster Blvd,Westminster,CA,92683,(714) 887-6156,"Tues, 3pm-7pm; Sat - Sun, 11am-6pm",,,c.dorney@4wags.org
119,Stafford Animal Shelter,Stafford Animal Shelter,www.staffordanimalshelter.org,3 Business Park Road,Livingston,MT,59047,(406) 222-2111,"Tues - Sat, 12pm-6pm",Contact to schedule an appointment.,,shelterbark@imt.net
120,Second Chance Animal Shelter,Second Chance Animal Shelter,www.secondchanceanimals.org,111 Young Road,East Brookfield,MA,01515,(508) 867-5525,"Mon - Fri, 10am-1pm, Wed - Thurs, 6pm-8pm; Sat, 12pm-4pm",,,info@secondchanceanimals.org
121,Santa Fe Animal Shelter,Santa Fe Animal Shelter,www.sfhumanesociety.org,100 Caja del Rio Road,Santa Fe,NM,87544,(505) 983-4309,"Mon - Sat, 11am-5pm",,,eviechec@sfhumanesociety.org
122,Fast Friends Greyhound Rescue,Fast Friends Greyhound Rescue,www.HelpingGreyhounds.org,14 W. Swanzey Rd.,Swanzey,NH,03446,(603) 355-1556,"All week, 11am-3pm",Contact to schedule an appointment.,,terri@fastfriendsgreyhounds.org
123,Central KY Regional Humane Society,Central KY Regional Humane Society,www.nokillcentralky.ckyrhs.org,214 Richmond Street,Lancaster,KY,40444,(869) 792-4581,"Mon-Tues & Thurs, 10am-6pm",,,ckyrhs@ckyrhs.org
